<?xml version="1.0" encoding="UTF-8"?>

<!--                                                 -->
<!--    Break-fix - Report SQLs DTD and XML          -->
<!--                                                 -->

<!-- Modification History                            	 		-->
<!-- 01/06/2005 | KW | First Cut					-->
<!-- 01/09/2005 | KW | Moved DTD to external file LSRExtract.dtd	-->


<!DOCTYPE reports SYSTEM "./../../dtd/LSRExtract.dtd">

<reports>

  <!-- Simulated Rejected Transactions -->

  <report includeHeader="Custom">
    <fileName text="CA_cycle2_rejected_onsitebfservice.csv" />
    <dateFormat text="YYYY/MM/DD" />
    <timeFormat text="HH:MM:SS" />
    <SQL text="
	SELECT 	MACH,SERIAL,LLI,PERIOD_END_DTE,SERVICE_DTE,DOCNUM,ECA,POSTAL_CDE,COUNTRY_CDE,WW_CDE,CASE WHEN STATUS = 'NEW' THEN 'N' WHEN STATUS = 'RESUBMIT' THEN 'R' END AS RESUBMIT_IND,'88888888' AS LENOVO_KEY,TRANSACTION_ID,CAST(99 AS INTEGER) AS REJECT_CDE
	FROM LENOVO.BF_BILLABLE_V 
	WHERE (PERIOD_END_DTE IN (SELECT PERIOD_END_DTE FROM LENOVO.PERIOD_DATES WHERE YEAR = YEAR(CURRENT DATE) AND MONTH = MONTH(CURRENT DATE)))
	AND (mod(cast(reject_id as integer),2) = 1)
    " />
  </report>

  <report includeHeader="Custom">
    <fileName text="CA_cycle2_rejected_depotrepair.csv" />
    <dateFormat text="YYYY/MM/DD" />
    <timeFormat text="HH:MM:SS" />
    <SQL text="
	SELECT 	MACH,SERIAL,LLI,PERIOD_END_DTE,DOCNUM,ECA,POSTAL_CDE,COUNTRY_CDE,WW_CDE,CASE WHEN STATUS = 'NEW' THEN 'N' WHEN STATUS = 'RESUBMIT' THEN 'R' END AS RESUBMIT_IND,'88888888' AS LENOVO_KEY,TRANSACTION_ID,CAST(99 AS INTEGER) AS REJECT_CDE
	FROM LENOVO.DR_BILLABLE_V 
	WHERE (PERIOD_END_DTE IN (SELECT PERIOD_END_DTE FROM LENOVO.PERIOD_DATES WHERE YEAR = YEAR(CURRENT DATE) AND MONTH = MONTH(CURRENT DATE)))
	AND (mod(cast(reject_id as integer),2) = 1)
    " />
  </report>

  <report includeHeader="Custom">
    <fileName text="CA_cycle2_rejected_installation.csv" />
    <dateFormat text="YYYY/MM/DD" />
    <timeFormat text="HH:MM:SS" />
    <SQL text="
    	SELECT 	MACH,SERIAL,LLI,PERIOD_END_DTE,SERVICE_DTE,DOCNUM,POSTAL_CDE,COUNTRY_CDE,WW_CDE,CASE WHEN STATUS = 'NEW' THEN 'N' WHEN STATUS = 'RESUBMIT' THEN 'R' END AS RESUBMIT_IND,'88888888' AS LENOVO_KEY,TRANSACTION_ID,CAST(99 AS INTEGER) AS REJECT_CDE
    	FROM LENOVO.INS_BILLABLE_V 
    	WHERE (PERIOD_END_DTE IN (SELECT PERIOD_END_DTE FROM LENOVO.PERIOD_DATES WHERE YEAR = YEAR(CURRENT DATE) AND MONTH = MONTH(CURRENT DATE)))
    	AND (mod(cast(reject_id as integer),2) = 1)
    " />
  </report>

  <report includeHeader="Custom">
    <fileName text="CA_cycle2_rejected_partslogistics.csv" />
    <dateFormat text="YYYY/MM/DD" />
    <timeFormat text="HH:MM:SS" />
    <SQL text="
    	SELECT 	MACH,LLI,PERIOD_END_DTE,SHIP_DTE,DOCNUM,CLAIM_NUM,PARTNO,PARTQTY,PART_COST,DIST_COST,PART_CREDIT,POSTAL_CDE,ORDER_NUM,COUNTRY_CDE,WW_CDE,CASE WHEN STATUS = 'NEW' THEN 'N' WHEN STATUS = 'RESUBMIT' THEN 'R' END AS RESUBMIT_IND,'88888888' AS LENOVO_KEY,TRANSACTION_ID,SERIAL,CAST(99 AS INTEGER) AS REJECT_CDE
	FROM LENOVO.PL_BILLABLE_V 
	WHERE (PERIOD_END_DTE IN (SELECT PERIOD_END_DTE FROM LENOVO.PERIOD_DATES WHERE YEAR = YEAR(CURRENT DATE) AND MONTH = MONTH(CURRENT DATE)))
	AND (mod(cast(reject_id as integer),2) = 1)
    " />
  </report>

  <report includeHeader="Custom">
    <fileName text="CA_cycle2_rejected_remotecustsupport.csv" />
    <dateFormat text="YYYY/MM/DD" />
    <timeFormat text="HH:MM:SS" />
    <SQL text="
	SELECT 	MACH,SERIAL,LLI,PERIOD_END_DTE,DOCNUM,POSTAL_CDE,COUNTRY_CDE,WW_CDE,CASE WHEN STATUS = 'NEW' THEN 'N' WHEN STATUS = 'RESUBMIT' THEN 'R' END AS RESUBMIT_IND,'88888888' AS LENOVO_KEY,TRANSACTION_ID,CAST(99 AS INTEGER) AS REJECT_CDE
	FROM LENOVO.RCS_BILLABLE_V 
	WHERE (PERIOD_END_DTE IN (SELECT PERIOD_END_DTE FROM LENOVO.PERIOD_DATES WHERE YEAR = YEAR(CURRENT DATE) AND MONTH = MONTH(CURRENT DATE)))
	AND (mod(cast(reject_id as integer),2) = 1)
    " />
  </report>



<!-- Simulated Approved Transactions -->

  <report includeHeader="Custom">
    <fileName text="invoice_cycle2_detail_onsitebfservice_CA.csv" />
    <dateFormat text="YYYY/MM/DD" />
    <timeFormat text="HH:MM:SS" />
    <SQL text="
	SELECT 	MACH,SERIAL,LLI,PERIOD_END_DTE,SERVICE_DTE,DOCNUM,ECA,POSTAL_CDE,COUNTRY_CDE,WW_CDE,CASE WHEN STATUS = 'NEW' THEN 'N' WHEN STATUS = 'RESUBMIT' THEN 'R' END AS RESUBMIT_IND,TRANSACTION_ID
	FROM LENOVO.BF_BILLABLE_V 
	WHERE (PERIOD_END_DTE IN (SELECT PERIOD_END_DTE FROM LENOVO.PERIOD_DATES WHERE YEAR = YEAR(CURRENT DATE) AND MONTH = MONTH(CURRENT DATE)))
	AND (mod(cast(reject_id as integer),2) = 0)
    " />
  </report>

  <report includeHeader="Custom">
    <fileName text="invoice_cycle2_detail_depotrepair_CA.csv" />
    <dateFormat text="YYYY/MM/DD" />
    <timeFormat text="HH:MM:SS" />
    <SQL text="
	SELECT 	MACH,SERIAL,LLI,PERIOD_END_DTE,DOCNUM,ECA,POSTAL_CDE,COUNTRY_CDE,WW_CDE,CASE WHEN STATUS = 'NEW' THEN 'N' WHEN STATUS = 'RESUBMIT' THEN 'R' END AS RESUBMIT_IND,TRANSACTION_ID
	FROM LENOVO.DR_BILLABLE_V 
	WHERE (PERIOD_END_DTE IN (SELECT PERIOD_END_DTE FROM LENOVO.PERIOD_DATES WHERE YEAR = YEAR(CURRENT DATE) AND MONTH = MONTH(CURRENT DATE)))
	AND (mod(cast(reject_id as integer),2) = 0)
    " />
  </report>

  <report includeHeader="Custom">
    <fileName text="invoice_cycle2_detail_installation_CA.csv" />
    <dateFormat text="YYYY/MM/DD" />
    <timeFormat text="HH:MM:SS" />
    <SQL text="
    	SELECT 	MACH,SERIAL,LLI,PERIOD_END_DTE,SERVICE_DTE,DOCNUM,POSTAL_CDE,COUNTRY_CDE,WW_CDE,CASE WHEN STATUS = 'NEW' THEN 'N' WHEN STATUS = 'RESUBMIT' THEN 'R' END AS RESUBMIT_IND,TRANSACTION_ID
    	FROM LENOVO.INS_BILLABLE_V 
    	WHERE (PERIOD_END_DTE IN (SELECT PERIOD_END_DTE FROM LENOVO.PERIOD_DATES WHERE YEAR = YEAR(CURRENT DATE) AND MONTH = MONTH(CURRENT DATE)))
    	AND (mod(cast(reject_id as integer),2) = 0)
    " />
  </report>

  <report includeHeader="Custom">
    <fileName text="invoice_cycle2_detail_partslogistics_CA.csv" />
    <dateFormat text="YYYY/MM/DD" />
    <timeFormat text="HH:MM:SS" />
    <SQL text="
    	SELECT 	MACH,LLI,PERIOD_END_DTE,SHIP_DTE,DOCNUM,CLAIM_NUM,PARTNO,PARTQTY,PART_COST,DIST_COST,PART_CREDIT,POSTAL_CDE,ORDER_NUM,COUNTRY_CDE,WW_CDE,CASE WHEN STATUS = 'NEW' THEN 'N' WHEN STATUS = 'RESUBMIT' THEN 'R' END AS RESUBMIT_IND,TRANSACTION_ID,SERIAL
	FROM LENOVO.PL_BILLABLE_V 
	WHERE (PERIOD_END_DTE IN (SELECT PERIOD_END_DTE FROM LENOVO.PERIOD_DATES WHERE YEAR = YEAR(CURRENT DATE) AND MONTH = MONTH(CURRENT DATE)))
	AND (mod(cast(reject_id as integer),2) = 0)
    " />
  </report>

  <report includeHeader="Custom">
    <fileName text="invoice_cycle2_detail_remotecustsupport_CA.csv" />
    <dateFormat text="YYYY/MM/DD" />
    <timeFormat text="HH:MM:SS" />
    <SQL text="
	SELECT 	MACH,SERIAL,LLI,PERIOD_END_DTE,DOCNUM,POSTAL_CDE,COUNTRY_CDE,WW_CDE,CASE WHEN STATUS = 'NEW' THEN 'N' WHEN STATUS = 'RESUBMIT' THEN 'R' END AS RESUBMIT_IND,TRANSACTION_ID
	FROM LENOVO.RCS_BILLABLE_V 
	WHERE (PERIOD_END_DTE IN (SELECT PERIOD_END_DTE FROM LENOVO.PERIOD_DATES WHERE YEAR = YEAR(CURRENT DATE) AND MONTH = MONTH(CURRENT DATE)))
	AND (mod(cast(reject_id as integer),2) = 0)
    " />
  </report>



</reports>
